{
    "generated_at": "2026-04-27T17:17:03+02:00",
    "source": "database-sync",
    "total": 16,
    "medicines": [
        {
            "medicine_id": 6,
            "name": "Amlodipine",
            "description": "Used to help control high blood pressure.",
            "category": "Cardiovascular",
            "price": 7.8,
            "stock": 42,
            "prescription_needed": true
        },
        {
            "medicine_id": 2,
            "name": "Amoxicillin",
            "description": "Antibiotic for bacterial infections",
            "category": "Antibiotic",
            "price": 8.75,
            "stock": 31,
            "prescription_needed": true
        },
        {
            "medicine_id": 16,
            "name": "Antiseptic Cream",
            "description": "Topical cream used for small cuts, grazes, and skin irritation.",
            "category": "First Aid",
            "price": 495,
            "stock": 47,
            "prescription_needed": false
        },
        {
            "medicine_id": 7,
            "name": "Azithromycin",
            "description": "Antibiotic used for a range of bacterial infections.",
            "category": "Antibiotic",
            "price": 12.4,
            "stock": 28,
            "prescription_needed": true
        },
        {
            "medicine_id": 8,
            "name": "Cetirizine",
            "description": "Helps relieve allergy symptoms such as sneezing and itching.",
            "category": "Allergy",
            "price": 420,
            "stock": 58,
            "prescription_needed": false
        },
        {
            "medicine_id": 3,
            "name": "Cough Syrup",
            "description": "Relieves cough and sore throat",
            "category": "Cold & Flu",
            "price": 150,
            "stock": 66,
            "prescription_needed": false
        },
        {
            "medicine_id": 9,
            "name": "Ibuprofen",
            "description": "Pain reliever and anti-inflammatory medicine.",
            "category": "Analgesic",
            "price": 510,
            "stock": 64,
            "prescription_needed": false
        },
        {
            "medicine_id": 4,
            "name": "Insulin",
            "description": "Used for diabetes treatment",
            "category": "Endocrine",
            "price": 20.5,
            "stock": 27,
            "prescription_needed": true
        },
        {
            "medicine_id": 10,
            "name": "Metformin",
            "description": "Common medicine used to help manage blood sugar.",
            "category": "Diabetes",
            "price": 9.25,
            "stock": 35,
            "prescription_needed": true
        },
        {
            "medicine_id": 11,
            "name": "Multivitamin",
            "description": "Daily vitamin supplement for general wellness.",
            "category": "Supplements",
            "price": 6.3,
            "stock": 73,
            "prescription_needed": false
        },
        {
            "medicine_id": 12,
            "name": "Omeprazole",
            "description": "Helps reduce stomach acid and relieve heartburn.",
            "category": "Digestive Health",
            "price": 8.1,
            "stock": 39,
            "prescription_needed": false
        },
        {
            "medicine_id": 1,
            "name": "Paracetamol",
            "description": "Pain reliever and fever reducer",
            "category": "Analgesic",
            "price": 2.55,
            "stock": 100,
            "prescription_needed": false
        },
        {
            "medicine_id": 13,
            "name": "Salbutamol Inhaler",
            "description": "Used for quick relief of wheezing and breathing difficulty.",
            "category": "Respiratory",
            "price": 18.9,
            "stock": 22,
            "prescription_needed": true
        },
        {
            "medicine_id": 14,
            "name": "Vitamin C",
            "description": "Immune support supplement with antioxidant benefits.",
            "category": "Supplements",
            "price": 5.86,
            "stock": 81,
            "prescription_needed": true
        },
        {
            "medicine_id": 5,
            "name": "Vitamin D",
            "description": null,
            "category": null,
            "price": 6.9,
            "stock": 69,
            "prescription_needed": false
        },
        {
            "medicine_id": 15,
            "name": "Zinc Supplement",
            "description": "Mineral supplement that supports immunity and healing.",
            "category": "Supplements",
            "price": 6.77,
            "stock": 54,
            "prescription_needed": false
        }
    ]
}